reviewId,userName,userImage,content,score,thumbsUpCount,reviewCreatedVersion,at,replyContent,repliedAt,appVersion
2e219268-96fd-400c-8632-0b0d1044f487,Natty Solomon,https://play-lh.googleusercontent.com/a-/ALV-UjVvOqNjcmiFvpg3wf626ccS0Kal2mOq6hxjoSjCb0xVC1fsg2cR,"This app is a joke. It crashes more than it works, takes forever to load, and half the features are just decorative at this point. Can’t log in, can’t transfer money, can’t even check my balance without it bugging out. To the developer: Are you actually trying to make this work, or is this some kind of social experiment to test our patience? Did you build this in your sleep? Because it definitely looks like it. If this is your idea of a functional app, maybe consider a different career path🙏",1,39,25.05.03,2025-05-21 03:49:15,,,25.05.03
3271d45f-2900-41b6-878c-669ac563e60a,Abel Hubena,https://play-lh.googleusercontent.com/a-/ALV-UjWrRWecXiEPR5kq-KmcJ2jlH_yPjJkqwWL3m0Prz7GBtliRKoLvWQ,It keeps showing this pop up to turn off developer options even tho it's off! I had to turn on and then off to make it work! This is a horrible experience and needs a fix asap! Plus kinda slow.,1,11,25.03.07,2025-04-18 21:15:54,,,25.03.07
7d475f3a-15b4-4e56-ae4b-1fc451749e61,Betanoise Shi,https://play-lh.googleusercontent.com/a-/ALV-UjWwiFzWQWfUAtfjPNZHbp_KrUNfO_2sMumta20H2N8SnPsMW9r7,"Edit: New bug, app not letting me type in my otp codes. Shameful Why does this app not allow me to use it while having developer options on? Did y'all consider that I might, perhaps, be an actual developer? Why am I expected to toggle the option on and off just to bank (restarting my phone when I do)? Why is the message labled as somthing that will ""smoothen"" the experience? This is like the most ""security consultant"" thing to implement in an app. Please invest in actual security, not this mess.",1,130,25.03.07,2025-03-12 12:41:25,,,25.03.07
3559b91c-fad9-4032-bebe-cf99974b9628,Robel Alebachew,https://play-lh.googleusercontent.com/a/ACg8ocKc3cWFE6DB-KelsfBZrSQ5KjVQ7TztXXm7wELqjMcFMLChYw=mo,"Hello, I’m facing a problem with the BOA Mobile app. Every time I enter my phone number and password, the app crashes and shows an error that says “BoaMobile closed because this app has a bug.” I tried updating, reinstalling, and clearing cache, but nothing worked. Please fix this bug in the next update. I really need access to my account. Thank you.",1,0,,2025-06-03 06:21:34,,,
301f6927-9395-4cda-bb77-041a36323875,bogale abunu,https://play-lh.googleusercontent.com/a-/ALV-UjUNALB1lGxqtlz7jPNG4uUMSvz5nifHfGqRn0KvjbgpsHkaWYg1,"i entered incorrect security question by mistake boa app lock pin forever, why is there no other options? ?? i contacted different branchs more then 4times but they didn't able to solve this issue .",5,57,25.05.03,2025-05-10 02:44:44,,,25.05.03
6fe3a0f0-e9dd-4dcb-81ab-e478b1239d55,Surafel,https://play-lh.googleusercontent.com/a/ACg8ocLyFeXuklzKqQ3lfgQivQYLVhdSKt4MGa-p6s8x45fURyEY=mo,"I’m giving this app one star because there are no options below that. My experience has been incredibly frustrating due to the extremely long loading times, and the app even closes automatically at times. People choose mobile banking for its convenience, but this app is far too time-consuming, making it the worst I’ve used. I hope improvements are made to enhance the user experience.",1,425,24.11.22,2024-12-07 11:40:19,,,24.11.22
94ef86ef-6437-4c31-96c5-efeb7f32829f,Yared Getachew,https://play-lh.googleusercontent.com/a-/ALV-UjXStUgSCFhTrcRyNDiKuvnzNtvi4hky6vzgOcFx9fZ_GA_vBSxd,i would have given it a lower if it was possible because it crush so much and it take the bank so long to fix the bug,1,6,25.03.07,2025-04-08 00:12:19,,,25.03.07
93bee220-7c85-4d30-ba6f-c8168c201b5a,Siem Kibrom,https://play-lh.googleusercontent.com/a-/ALV-UjXhX7rzu8tDLpYokVGoO_AzE87E9s5E50Ymdo1yGfFERJZuiRc,"This is the best app; many features are awesome, but it should work without the need to turn off the developer options. I'm tired of having to constantly switch the developer options off and on. I've been expressing my struggles about this. I have precious settings enabled in the developer options, and to open the App Boa app, I have to turn them off. Please help us, Abyssinia Bank. I hope you can provide an update soon.",4,38,24.11.22,2024-12-08 12:16:05,,,24.11.22
b42ad5f5-049c-49dc-a13c-39b7414793d0,Net3 MP,https://play-lh.googleusercontent.com/a/ACg8ocKWtkXRLXdwZ6w7Gar7V9w9rtXmtnjawICBUcptbO7L8uRlLA=mo,"I don't know what is wrong with BOA as a bank in general. It's been going backwards since last year or so. The app is a disaster to use in every possible way. Not stable to log in and very slow to perform transactions, couldn't take a screenshot (or can't even find the pictures even using its save screenshot option). Most of the time, it fails to perform transactions and so on. Simply, it's the worst!",1,547,24.07.04,2024-08-03 13:59:13,,,24.07.04
91fa4fb9-0eb5-41f3-81b0-c40aea7e51ff,Brish Kidane,https://play-lh.googleusercontent.com/a/ACg8ocLRqP05Dolp3q0usxF1tNwwYizMHu5ruDx9fNTzVgF0CCuimg=mo,What's wrong with App. this days? it doesn't working properly. 1) it's VERY SLOW & doesn't open. it's very Annoying. 2) most of the time it says repeatedly Please try it again or try it later but again and again it doesn't open or work. 3) repeatedly it says something went wrong then it off the screen. I've updated the App. when it needed but nothing changed. 👉PLEASE if it has some issues with the App. Please fix it otherwise I'm going to uninstall it.,2,319,24.05.07,2024-05-08 05:59:05,,,24.05.07
ec7606a9-f681-4662-89b9-7b253d145629,Mr Sanchez,https://play-lh.googleusercontent.com/a-/ALV-UjUyukkZxYN_21s5DsMfBfyitYHypWPlpKN4mjwq-ux328Hv1HMr,"I have a fitayah account, a type of interest free account, and because their system is unable to process anything for people like me I can't see any of my accounts in the account list on any transaction, although I can see it when performing security actions or checking my balance, as such this app is as useless to me as the previous one. Unbelievable",1,934,24.02.07,2024-02-17 22:28:12,"Dear customer, We are sorry for the inconvenience please contact us at 8397 and share as much information as you can. We will investigate your case. Thank you!",2024-02-22 04:53:42,24.02.07
f8bb86fb-594a-48ea-be1f-d08ea0882b8e,Dagar,https://play-lh.googleusercontent.com/a-/ALV-UjXry0c8QCddJq6XwpLxmwwurl90WsOem5lxbxRhT69R8W0ZDK9T,Worst App ever. Totally unreliable. And it didn't work at all for the last 4 months.,1,4,25.05.03,2025-05-18 05:36:47,,,25.05.03
4fbd4527-b629-488c-8ac7-8546e4e4ee9e,Hamilan Nano,https://play-lh.googleusercontent.com/a-/ALV-UjURiHZ3kz9wXjChAmS2VEgfjsi_ApC3crW7TwPkpFXtqJh4sIMx,"What an awesome app! It is supper easy to use with very attractive GUI. But there are some problems to be addressed: (1) It crashes frequently and requires mobile cache to be cleared to relaunch. (2) Automatic OTP input is good. But fix the manual activation option, too. (3) It does not boot fast. (4) There are minor errors during the installation. (5) Color contrast: In the transactions menu, the credit accounts should be in dark green than light green. The debit accounts should be in dark red.",5,1804,24.01.09,2024-02-06 10:14:35,,,24.01.09
daec843b-9c90-4779-9aa3-630128589864,Dagim Sisay,https://play-lh.googleusercontent.com/a-/ALV-UjWjhFXhjLN3yJu2J2IZsl8W1Uf5z6iKhoy-Ku7lK2zARDA-2BDQ,Can you please just make it functional. I don't think anyone cares how good it looks if not a single functionality works. Plus it's not even aestheticaly nice. The loading animated icon has white irregular edges because the logo wasn't cut out correctly. The app doesn't work at all. It doesn't even login. It gets stuck on login just showing the logo animation and blames the issue on connectivity. Connectivity is fine and the proof is that this review is posted.,1,365,24.02.07,2024-04-15 02:30:58,,,24.02.07
03ed7b23-17b8-4ae5-9c2f-29922a888edf,Mohamed Jamee,https://play-lh.googleusercontent.com/a/ACg8ocIGESTosdCC9VVssxzGbTtQ_MLw7hKmL-i6aWF0w2JBS1EfFw=mo,"Terrible Bank Experience It’s unbelievable that with all the modern technology, this bank still struggles with even basic transactions. The app constantly crashes, services are limited, and every time I try to transfer money or load Telebirr, there’s a huge delay. I have to wait 5 days for failed transactions to be refunded! Even USSD is unreliable. They’ve put me in embarrassing situations countless times, and customer care never fixes anything. I’ve switched banks, and you should too!",1,21,,2024-10-13 22:06:39,,,
c150161c-e679-408f-aa76-41f4c9787f9a,Abraham Assefa,https://play-lh.googleusercontent.com/a/ACg8ocLDXUcCjNSIqT-bF4uwFu34C0pHj4AYR7SLLmXS8T4vV8HjtA=mo,"I have a worst experience while using this mobile application through out the year. Most of the time it fails to ""Login"" or automatically closed the app. And also it takes so much loading time (5 minutes +) trying to access the internal services. Sometimes also while transferring within and to other bank also fails. So, BOA please fix your app.",1,73,24.11.22,2024-11-28 19:40:35,,,24.11.22
8a4d9c01-9e5a-4732-a8ab-9341930b30c8,Nahom Abebe,https://play-lh.googleusercontent.com/a/ACg8ocLRFdZ5Nv2Vc17s9gmMXS_GfT3mVhKlWyxrIP49GsiyGHihcZQ=mo,"the app isn't working after it asked me the password it starts loading, but it doesn't open",3,4,25.03.07,2025-04-20 11:05:21,,,25.03.07
a2fb35e2-3828-4626-bddb-7443e04bf770,Ebenezer Daniel,https://play-lh.googleusercontent.com/a/ACg8ocKwqaL1Crk_urTq8T6rkjqMEMxyV72_fYOUQhaExHyjAmOuKA=mo,"It crashes frequently. It launches on Android 8.1 but I don't think it actually works on versions less than 10. If so, it shouldn't be available for download by such devices to begin with, like many other finance apps are not. It was so much better three months ago, upgrades should be for the better.",1,14,,2024-09-06 00:06:12,,,
07b87145-49d8-4394-bbf7-73e43dec9ac2,Kirubel Getachew,https://play-lh.googleusercontent.com/a-/ALV-UjXEPA8qniuonXgVKhXaaWtljJcDJocATDnXf1T39YVho4a5edeq,"Developers/ the company takes too long to update the app, and throughout that process, the app is basically useless. We can't send money or even be able to check our account. They even take it down from the Play Store for a while. This whole process usually takes them 3 to 5 days. This is very disappointing. It is an improvement from the previous version of the app, but they still have a long way to go to compete with the likes of CBE. Transferring to other banks sometimes doesn't work.",2,182,24.04.26,2024-05-03 00:28:07,,,24.04.26
e52a6ccb-dc16-472c-84ef-2969c08a9318,Nahom Tesfamikael,https://play-lh.googleusercontent.com/a-/ALV-UjVdLDHs0A6z9aW1dG-vrDMpSIsjccMtGkcpl_MtI0yPySKYloG2,"It can't actively on initialization, it says incorrect OTP getting the exact OTP",1,4,25.03.07,2025-03-29 04:29:38,,,25.03.07
dbd9dbf2-47ee-4103-8631-cd0ef79f4344,Natina'el Taye,https://play-lh.googleusercontent.com/a-/ALV-UjVrI4MILJEspf7LceYOswa-78YQoKxP6lWtAZZhExX8T5EMS24Q,Bad app . it stuck when you open and noting WORKS.,1,2,25.03.07,2025-04-23 04:16:20,,,25.03.07
62fa097e-3fd8-4522-a3a3-9b13f17f594d,Ahmed Abdo Bedaso,https://play-lh.googleusercontent.com/a-/ALV-UjVskSAmT2ssPhP_eVaTgOhXTop0J4YEM0Lw6dgqrB2sT5B2LU5u,"This app future is good, but there is problems with apps to reset and activate it, which is difficult even to the branch staffs, and it takes too long times to active at the branch plus most of the time high expected failure of activation after process at the counter and OTP sent not work",1,2,,2025-05-06 08:06:33,,,
5072a136-5343-4309-b265-14b5b12f9bd3,Ebrahim Chekol,https://play-lh.googleusercontent.com/a/ACg8ocL4XR0bGi8WmOrcvhqbTTaBCUEGJO884KtEbs0I7Q2e_6GBEQ=mo,"Why the app doesn't allow to update the previous version. In addition to this, when I install the new version and try to activate, the app doesn't allow to write the activation OTP code to the screen. I have received the OTP password from telegram and email. Would you please fix this bug. Thank you",1,553,24.01.09,2024-02-03 11:01:10,,,24.01.09
91aacf0f-e666-4add-b7ca-4f952bb86899,Sinte Alex,https://play-lh.googleusercontent.com/a-/ALV-UjXn2weGLWGYYrZrrcp2Rc7hhjaZdGSoa2bYP4FTIjPkFwtkK14,"This app has been found useless while I compared with the first version of IB12111...that was very good, you guys what is the matter with you. You are far from the technology and the competetor's digital product through convenience, reliable, easeness _-dashen, cbe, zemen... they are doing well! share their experience and be able to satisfy your esteemed customers including me. unless you will be down soon!",1,8,,2024-04-29 10:18:09,,,
a7888312-64d5-44d6-b708-a6d29b168825,abebe mekasha,https://play-lh.googleusercontent.com/a/ACg8ocJnfrWqbULh_CoB5I_tJSfvGFj78DQIC3mIe8WtEGtaVso7NA=mo,"I will give only one star, because it faced with multiple of problems. 1. The app is not as fast as the other banks App, for e.g like CBE 2. The App asks repeatedly to switch off developer options, even if it is switched off. 3. Bank of Abyssinia's services are interesting, but they ignored the issues on the App service. 4. Most customers gave a complain on the App, but no one accept their complain to fix the issue. 5. Lastly, I will not recommend the App unless the issue has been solved ASAP!!",1,19,24.11.22,2025-01-02 20:56:58,,,24.11.22
180bed10-eda6-4491-84cf-93d55ff8d92c,Christopher Edward,https://play-lh.googleusercontent.com/a/ACg8ocKGm6a44Sjff9yfvOnQqtyh_hyl8v_2FQC-1nWTfO2W_vKcIw=mo,This app is incredibly frustrating to use. It’s filled with issues that make it difficult to navigate and complete tasks efficiently. I’ve never encountered such a poorly designed banking application before. It needs significant improvements to enhance user experience. It deserves a vey low rating.,1,9,,2024-09-26 11:13:35,,,
c7640934-b677-425d-acdf-26fd1560e10e,Abeni Tutorials 2,https://play-lh.googleusercontent.com/a-/ALV-UjX-pFPk6T-Yzk8LaKAjOUhNVk_rlD_kfewBKjeN3cL5Hy2u0Pw,"The version 24.04.26 is not opening on any of my devices. I noticed this issue on my friend's Android 9 phone and also on my Samsung Android 12 phone. Even after weekly updates, the newest version is not working properly. Please provide a stable version update, as I prefer the older version of the app from the new one.",1,7,,2024-05-04 12:44:53,,,
9815bb8a-2108-49fe-8292-fb360aed8331,Emmanuael Asrat,https://play-lh.googleusercontent.com/a/ACg8ocKRDCszCOez4HIQ8fNnbmfSWqZcAZ2sgfKZBS7p2DBAvf0zqYo=mo,Very unprofessional and mischievous bank in my opinion. I have had several occasions but recently I used Abyssinia Card to withdraw money and it was deducted from my account but despite reporting several times they said they are processing it but I learned yesterday that since it has been 3 months the bank has decided to include it in their income. How absurd. If you can avoid this bank.,1,12,24.09.30,2024-12-06 06:19:23,,,24.09.30
cf142536-5be5-4353-b2e2-359e4b4622ae,Ezra Aklil,https://play-lh.googleusercontent.com/a-/ALV-UjVOJvM7bNGnTA9TLy4hXLWLmIigi9ZSg7PsHwi0mwsXzrdhiyHo,"So BoA, your last application was horrible and buggy. And we thought ""finally!! a functional new app with better UI."" But It didn't last long, a non existent connection error at login.... Please just fix your app to the simplest functional form and it would be up to your other service standards.",1,81,24.02.07,2024-04-21 13:41:32,,,24.02.07
2795b1e3-ccdc-4b4a-8c25-cd4c6cc0d2ba,Matias Kebede,https://play-lh.googleusercontent.com/a-/ALV-UjWoe72JjzlnuPlFAP-LkiZeZwhOwZKMlpbdlkpdJQ6duvPuTA3sIg,It has been a while since you guys started giving the mobile app service but still couldn't get it to work. I'm sure you know that it doesn't work already but not sure if you're lazy or incompetent to fix it. You are losing business because of this. Complacency will have consequences.,1,19,24.11.22,2024-12-09 22:43:57,,,24.11.22
6eec96bf-b4c9-4dde-9814-059cf54b3f86,Abel Getachew,https://play-lh.googleusercontent.com/a-/ALV-UjUkaycJeMeh_DqBMOGrF_SIv-5Cdunku3YbxuMtFpRYbjrZYfA2,it doesn't work period z slowest mobile banking ever i would rather use *815#,1,1,25.03.07,2025-03-31 14:27:34,,,25.03.07
c78f1ddc-5a45-4a99-b001-d1541be9fea4,Alemayehu Zerihun,https://play-lh.googleusercontent.com/a/ACg8ocJfdAwAGbZJbTtIixPqLIfgrJZmmF53Kj5Cj03OvoSr7FHSvw=mo,OMG this is like the worst mobile banking app ever. I have many different mobile banking app from different banks but this is the worst so far. It says it has connection issue when I have wifi or data connection and while I'm using other social media apps. It keeps asking me for update once like every week and takes forever to load like I have to wait at least 10 minutes to login and another 10 min to see my balance.,1,5,,2024-05-02 10:09:54,,,
ba55af7b-4023-4862-ba6f-9f2ac3b681b7,Mohammed Ahmed,https://play-lh.googleusercontent.com/a-/ALV-UjWnBIwvDex4MSG4HFB2jYEYrCvDKjBjyPmOlHnyqokNv2V3lq8,"Was working fine for 2 days then Error the request was not successful please check your connectivity or try again my connection works perfectly i reinstalled the app called support multiple times all of them said it's a system problem be patient it has been a week since then, called again they even dared to say the problem is your phone restart it which i did but still the same other banking apps work perfectly but this my experience with this app, horrible the whole system is bad",1,142,24.02.07,2024-02-14 04:22:56,,,24.02.07
243b532d-869b-40a5-931c-a7fec1297cf6,Elias J.,https://play-lh.googleusercontent.com/a-/ALV-UjUy9wN_Ae5t7q85TrJvlcD8pP5QQvEETK5YtoNyv8zpDwG1ja0p,"This is a much better app from BOA, easy to activate with ATM credit info, that helps someone like myself who already forgots previous PIN No or IB password. Apps runs fast unlike the previous versions. I hope you don't ruin it with unnecessary update. Please notify customers to use this app through their SMS.",5,819,24.01.09,2024-01-18 10:40:54,,,24.01.09
a3f239e6-b1c6-4910-8d4d-5db544802d31,muna bayou,https://play-lh.googleusercontent.com/a-/ALV-UjV9UPp6staKJyrmBhrDaNbRXuUMWL8t-B3ZKg4PsD8jTyW-Y64,"The app does not work well from abroad, there have been continuous upgrades and updates that are very interruptive and non-responsive. Staff do not have the technical capabilities to support whereas the support number and online support are never available.",1,75,24.02.07,2024-02-12 05:10:57,,,24.02.07
66fafa2a-e28c-44d1-a7ce-dec09bb3c929,Yohannes Fikru,https://play-lh.googleusercontent.com/a/ACg8ocI044EEdeRghs82Lh09TzkynkLpNKYhyFL7wiY5nHGNocOpOw=mo,This app is not efficient and can't be used for people outside Ethiopia. I am not able to enter back my OTP code into the App screen as it gets frozen and nothing can be done. Also the login screen forces to enter a local cell phone in Ethiopia and a PIN number. Those of us who live abroad are left out. The previous application with BoA Authenitcater was working efficiently and I was also able to login using my LapTop. I recommend the Application to use login user name & email instead of Ph#.,1,39,24.02.07,2024-02-23 12:03:31,,,24.02.07
663df513-c514-48fe-9c8f-4d9b244a7bef,Nebyu Amaha,https://play-lh.googleusercontent.com/a-/ALV-UjW41wwRCnNqUMoYyKN-sCwFaKD9PhY8Bj492NgXsvW6K16f9C16,"Be careful of using this app to transfer large sums of money. Recently I can't top up my mobile card, can't pay tickets, can't transfer money to Telebirr. The *815# works but what's the use of an app if we're using USSD. It will refund your mobile top up days after failing to top up but I wouldn't want to risk that. I'm a big fan of BoA but I wouldn't recommend this app. 👎",1,2,,2024-05-15 04:14:40,,,
6856f9cd-42b9-4ec3-879a-d7893bf12b69,Dawit Mengistu,https://play-lh.googleusercontent.com/a/ACg8ocI4cvM6H-csAUszZl4O7YytsN5_tPrVEoD7tqL7fMKPOUwNfw=mo,"Very poor app. It crashes every time, doesn't load properly, and you can't even buy airtime. The programming is subpar. Please take lessons from other online banking apps. I would give it a zero if I could!!",1,3,,2024-05-10 05:57:32,,,
dfbe9aad-91a9-4bc9-8aac-1ecf644d89bc,Biniyam Tefera,https://play-lh.googleusercontent.com/a-/ALV-UjUZBKLtmqIWHyQPf-fEQffOUPwk6V-meB42ncmmvOuovyLdxLDwiA,"The app doesnot allow to transfer from foreign currency accounts to local currency accounts , it says transaction not allowed , please check it and also it is difficult to activate the app from abroad countries since the otp doesn't reach by sms and it uses email, it doesn't allow manual otp input and the email hardly received , please review your app and make an update !!!",2,25,24.02.07,2024-03-22 05:17:14,,,24.02.07
d0445199-84e3-493e-8d94-2c6583616901,Amin k,https://play-lh.googleusercontent.com/a-/ALV-UjUjKKRszHNHXiXvahyrpf-7Yh-iNLl9Mug4eiQAZjU2UGObPYD8,"When we come to use mobile banking app this app is the WOREST one. Who made this app? Why? im almost forget to use it While the app right infront to my phone. I preffered to go branch office rather than to use it. Let alone for transaction or other service for simple purpose to check my balance i used to call for the bank 'call center' rather than to open for this difficult app. It need high speed internet service, it stop service for simple interuption of the network, after transfer the 1/2",1,6,,2024-02-13 07:35:34,,,
b95b5757-59e6-4147-9c90-c5bb787386c6,Abiy Ephrem,https://play-lh.googleusercontent.com/a/ACg8ocK1FUU7QyYWXyqVifzX2-B7T-Wwpdd2I_1vkysiGNENcJ1MXQ=mo,"Please add an option to manually input the OTP. I am residing outside of Ethiopia. I encountered difficulty accessing my account following the recent update (change) of your mobile banking app. Unfortunately, I am unable to activate the app on my mobile device. During the activation process, the app prompts for an OTP, which I can receive via Telegram. However, there is no option to manually input the OTP. I kindly request your assistance in resolving this matter and activating my account",3,131,24.01.09,2024-02-03 12:48:59,,,24.01.09
f0fe277f-65c1-461c-afad-8cd40c6ab368,habtamu soressa,https://play-lh.googleusercontent.com/a-/ALV-UjWZ_1TgoV0ShDP0DUP1kia5oqMlPFNcEpMkZvKhlebGmkTUbilW,"It's been two months now, I cannot do any transaction using this app. It's really disappointing. I am using bank of Abyssinia currently because it's the nearest bank to my work place. The bank is turning to the worst bank in the country day by day. They always respond to customers that they are updating their system all year long, I think that's what they train their customer service operators to do.",1,21,24.05.07,2024-06-26 08:45:58,,,24.05.07
d9506985-4b35-431f-81f7-f9388ddb14d2,Bethel Sileshi,https://play-lh.googleusercontent.com/a/ACg8ocK8_jxWwoibLWpNPYKmMXP-muN__CPnKQFPRcXzIljQalkQHj4=mo,"The worst mobile banking app! It doesn't load (seems like with the perfect WiFi and data connection it still manages to have network issues), when you finally get into the app, it makes it so hard more than it should be to send money.",1,69,24.05.07,2024-05-31 09:55:46,,,24.05.07
322c12e9-1e9a-4609-b4c0-3ef5f78ff589,Yonas A,https://play-lh.googleusercontent.com/a-/ALV-UjXjmqRijwRp6VOnJeChEHrGETK1Q48QR-Nnzex9FR6vYtlCqkI,"Playstore need to have some option to give 0 stars because this application right here, deserve exactly that, imagine being one of the biggest banks In the country and can't manage to have good mobile application in the Era of mobile money, you guys are in the brink of collapse you better make it right real quick or you gonna be 10 meters down to the grave. DON'T USE THIS APP, IT'S WASTE OF TIME.",1,121,24.05.07,2024-05-21 03:17:07,,,24.05.07
8bbe29d8-ec75-4ffb-9b2d-fe22c62b1182,Zeda Smart,https://play-lh.googleusercontent.com/a-/ALV-UjX7OZuoJx1shmnH1F6y_FRY-HFk0nNzitQganFzRR01DWkRdns,"The updated version of this app is just time wasting. It doesn't work with 2G/3G network.require log in frequently,not fast as much as possible.automatic log out are the bad features of this app",1,22,24.02.07,2024-04-13 03:51:14,,,24.02.07
14339503-d7a7-475c-bd75-f4240eee990c,selam selam,https://play-lh.googleusercontent.com/a/ACg8ocJjeWu3nUdiNkppGZg8Rh6iy_PQcvuxkQiPMO2CAKF7g1F4Hg=mo,"This is terrible app. What the hell is your problem. Passwords can't be entered manually. I'm abroad. I don't have my Ethiopian Sim. I'm receiving the activation code via telegram. But you locked the system not to accept the activation OTP manually. Hence, I can't see my accounts, I can't make transactions etc.... how can you not think of this in advance.... now I'm in a terrible situation. I can't know what is going on with my account. WOULD YOU FIX IT NOW.... NOT TOMORROW or THE DAY AFTER...",1,3,,2024-02-15 17:47:47,,,
5491d730-4219-44e7-804f-3089aa98f554,Dawit Zenebe,https://play-lh.googleusercontent.com/a-/ALV-UjW2O0NSR2FqVaQHus-DktqKdqX5DJ7c2Svcfz_tcH4E8euoaddE,"This app is trash, it's not working for the past 3-4 days. I've to go to the bank to send money to other banks. Plus the app keeps crashing since the last update. BOA as a bank is deteriorating! This has to change.",1,326,24.04.26,2024-04-30 10:45:24,,,24.04.26
6aba852c-18d6-4a41-a154-74c6184959ad,Shalom Abebaw,https://play-lh.googleusercontent.com/a-/ALV-UjX0Xd7wIcuBJJ7vzkul0ekI3nfH6eTlX2Lj31o11GntIcxRtDlM,"The worst mobile banking app ever!!! I have tried to transfer 25,000 from my BOA account to my CBE and it still hasn't reached my CBE account yet. When I tried contacting customer support they just tell me it's a problem with the system. I have waited 48 hours and I still haven't received my money. Bank of Abyssinia the worst bank and system, I don't recommend this app or bank to anyone.",1,30,24.02.07,2024-03-01 04:31:20,,,24.02.07
