reviewId,userName,userImage,content,score,thumbsUpCount,reviewCreatedVersion,at,replyContent,repliedAt,appVersion
e8e30cda-3c44-4a11-93cb-89f93fcc4e95,Dagmawi Alemayehu,https://play-lh.googleusercontent.com/a-/ALV-UjXVv6AdcgKxBFSFCdbbZdA5ZGHu8jZqNtqD5sQZKCu172EVF6Ez,So this updated version is so much better and faster but it doesn't open unless it's directly opened from play store. fix this issue I'd give it 5 if it wasn't for this,3,6,24.02.07,2024-02-16 09:46:54,"Dear customer, We are sorry for the inconvenience please contact us at 8397 and share as much information as you can. We will investigate your case. Thank you!",2024-02-22 04:55:28,24.02.07
b5ed4d5f-b0f7-4ef4-9b2f-3b12b1f2f50c,liul shewaye,https://play-lh.googleusercontent.com/a/ACg8ocKT7SXBqW0NhEtjrKKQDBOXWQ1Awma4QTAjlBCmLkAuPN4nMkk=mo,"I sm a big fan of BOA , but the mobile banking is so trashy( sorry but its the best word to discribe it).... please buy a good server ....it always show blank age after login slecially on sundays it does not work at all...the new update has a good UI but has same respose problem ....",3,4,24.01.09,2024-02-11 05:41:30,,,24.01.09
e9336bcf-b836-4e42-9d5a-f5999513effa,Yosef Alemu,https://play-lh.googleusercontent.com/a/ACg8ocJ-VmX2qDIVH1xLVF6kiZfBNEsFZk3w9Zq8NHFLWbdqh2-NdQ=mo,"BOA app was one of my favourite back in the days, now I don't if there is an app worsen that this.. very very bad. You need to fix it or remove it.",1,15,24.04.22,2024-04-23 23:34:18,,,24.04.22
123f1456-c770-45aa-b5a7-d5491958f2c0,Iyasu Shiferaw,https://play-lh.googleusercontent.com/a/ACg8ocJ5kJUhHx4_mPF8yTjyK2Dot1eRFf-SqI3Ttt7-I6jFQSUJsQ=mo,Hate how we're expected to disable 'Developer Options' everytime we open the app. An unnecessary point of friction that's been put in place in the guise of security.,2,6,24.05.07,2024-05-14 00:09:43,,,24.05.07
9a4768a8-faca-4f72-92cc-4194d7bce0e3,Dagim Family,https://play-lh.googleusercontent.com/a/ACg8ocJyI1opK86A1Z4FAa_KO1-51JsRzZbTVXp73dKuoNySJ7OZgw=mo,"Dear BOA, Are you sure you are upgrading your application. It is becoming worse and worse. Please fix the bug as quickly as possible.",1,0,,2024-05-02 21:10:15,,,
aaa1abe6-69f5-4150-9072-0b456c58efb8,Yigrem Girma,https://play-lh.googleusercontent.com/a-/ALV-UjWPK_ELq_DncbvJBB0glwdDLEy84dMyORBBV8ueCm2UiJJsnXVk,"The app is a total waste of time, it glitches, doesn't log in fast, super slow.",1,8,24.02.07,2024-04-21 01:03:23,,,24.02.07
1fcdba36-6e83-434b-8676-66304e004a60,yohannes tegegn,https://play-lh.googleusercontent.com/a/ACg8ocLEt29mX8hFcUM7bgbShfGrKJ1GGeLS6XVhD0lVhe-KWHnaDA=mo,"It's a quiet good and smoothly accessible app which allows users to transfer , Airtime Top-up, ATM withdrawal and Utilities payments.",5,34,24.02.07,2024-02-23 22:49:42,,,24.02.07
f467c327-ab9b-4e79-8d97-2e1b573f6c98,Hamon,https://play-lh.googleusercontent.com/a/ACg8ocLmNzB-Bm_1-3gAW-vGszZeOCppXWUrjIgEtdEaN0SrCdXNReA=mo,"I love BoA more than anyone but they are cursed when it comed to mobile banking. Even though this ine is hetter it still s*cks! It will ask me to turn off developer options other wise it won't work! I use CBE, Awash birr, tekebirr, Dashen bank and others but non of them asked me this, why only BoA? Please improve your mobile banking, be competitive!",1,8,24.11.22,2024-12-18 19:02:34,,,24.11.22
a7249a34-f5f8-455e-8f33-7a1acc03ce90,Fissehaye Weldu,https://play-lh.googleusercontent.com/a-/ALV-UjWNwMV8BpGtZ7rW4iM-O-xMuDVmax7DaOeUSrHP2_ePjfxc4eyjBg,"Was working ok.but it started not displaying banks list to choose from, and it needs updating every couple of days, annoying",3,0,,2024-05-02 21:39:03,,,
497345df-10e9-402a-bb96-88e16f8a803d,Tsegaye,https://play-lh.googleusercontent.com/a-/ALV-UjXSRy_sqj-sM5x9_STOAc9fTbWngaon6HwHTQOBXKU_DsYmD9To,boa of mobile backing,5,0,25.03.07,2025-04-09 04:32:34,,,25.03.07
2ca9480b-ff5f-4b59-952c-5921db83dab2,Ahadu tech,https://play-lh.googleusercontent.com/a-/ALV-UjWOhd6tDkB5D0Ws9KjbNiDZMM0fSVJ0ykgIWeFwpaPTgsqmNCU,this is worest app 24/7 loading,1,0,25.05.03,2025-06-01 05:51:10,,,25.05.03
78c924d7-0a65-415c-9fca-bda9b078a157,Kibrom Mebrahtu,https://play-lh.googleusercontent.com/a/ACg8ocI_K80h76ramNzHxGxcQDmtMmg4-qbSWAqr1NmApNLL8fQDOw=mo,very nice Abyssinia bank is choice all,5,0,25.05.03,2025-05-31 01:55:58,,,25.05.03
76089146-b1c7-47f4-ab9f-44b6a1092225,Tewodros Regasa,https://play-lh.googleusercontent.com/a-/ALV-UjWFdK2_RF3rbaPiwkRygKeobIf-Wu3NRloIJKctPROqaAuyebQi,the app crush frequently,1,0,25.05.03,2025-05-24 02:24:56,,,25.05.03
f001bc11-3899-462e-8416-919d4f8b575d,Abner Dimetros,https://play-lh.googleusercontent.com/a-/ALV-UjWA3Ra8a4aYTcSb8A6QavOYXg-x3O7qnJL-_Op6BlXb-Kph8mll,"I am an app developer, I need to keep developer options on... WHY ARE YOU ASKING ME TO TURN DEVELOPER OPTIONS OFF... why is it that Abyssinia is the only damned bank in Ethiopia that just can't seem to buld an app that works... it's not that hard people, just look at CBE... this is simply terrible, borderline unusable!",1,6,24.05.07,2024-05-09 04:13:42,,,24.05.07
1d71b9e5-39e0-4a6b-a6f3-eb0d34c6f007,Yoseph Araya,https://play-lh.googleusercontent.com/a/ACg8ocJumpFmJU8Ql-UITIB_mcr1TNXavuI85Y5jk5hPSZYRkqFMlg=mo,"Absolutely the worst mobile banking app.it crashs every time,problem when logging in and and cuts my balance when top up without even recharging",1,7,24.04.26,2024-05-17 12:21:05,,,24.04.26
857bb685-6f7e-4db0-af37-eb2f1c1c6fd3,Abdu berHanu,https://play-lh.googleusercontent.com/a/ACg8ocJjoZv87agxo3zkbYHkpDgp5LOsmx4bjWgO6tAxzjQT0bJbBg=mo,liking this application good 👍,5,0,25.05.03,2025-05-07 08:34:10,,,25.05.03
c3f2810d-cf99-4600-90ac-bef47adb9e7a,Ethiopia,https://play-lh.googleusercontent.com/a/ACg8ocKgfyrWh_dWm13iUdnsiv6Y3B_9hY_rTiI67hppjky8hpEOBw=mo,"this app, for me , is a waste of time. It doesn't work . I can't even long in, and it really piss me off. FIX THE PROBLEM",1,0,,2025-05-27 11:16:27,,,
34f5b18e-0a79-40bb-94b6-4430d08e0c17,Michele Graffi,https://play-lh.googleusercontent.com/a-/ALV-UjVhogmcjhNlc6uExtKsURGMnlZbo3NX6G-YjJpYk18Qs_lQWDjRHQ,always problematic hardly works,1,1,25.03.07,2025-03-26 03:28:25,,,25.03.07
c5cdb617-4335-491d-89ce-9c1aab9b0b2f,Noah Daniel,https://play-lh.googleusercontent.com/a/ACg8ocKQpSKVHU0UhCOeoZsA99QNxGYpR939DTIZgtHM2eHNlocFJw=mo,"For anyone who wants to download it, just don't!!!",1,0,25.03.07,2025-03-19 06:02:57,,,25.03.07
1197ad29-5063-4999-888c-589582754caa,Hone Boy,https://play-lh.googleusercontent.com/a/ACg8ocJ94dBkQntspJfmKqbrM0zmMry5oAXsC9mSxVdmbgf1GAu49YE=mo,"after activated the application it not allowed to sign , automatically it is turn off In my phone, why ?",1,0,,2025-03-31 13:55:06,,,
73ce76e4-b7a2-4ed8-b6fd-f9b388bdb4a6,Teddy Abayneh,https://play-lh.googleusercontent.com/a/ACg8ocI5qBqlzQdwbrO7evldVwAEBPArhIptGQfqyv2yv7D0NamS8r8=mo,what awesome apps. it is very simple to use and more much important apps.,5,1,,2025-03-09 00:34:30,,,
b640cc87-df88-4b6b-9b9f-13fe0bdd5dfa,fire biru,https://play-lh.googleusercontent.com/a/ACg8ocKGXwSjfQH8MlM1J14zYWoc7q2nqnsFcm6waB-R2fWUuE51Ag=mo,"this app does no work on Samsung a51, it just gives a preview of the logo",1,0,24.09.30,2025-05-11 09:07:08,,,24.09.30
83270146-a02f-4b96-a30e-f056b6b2acc5,Desta Deressa,https://play-lh.googleusercontent.com/a-/ALV-UjVaIk-ngzHLHZGKYbISrdAV4JkzIOk9hsVcY0p6T0ct5tgzwu15,It is very bad app. not friendly usable. needs extremely strong network. Can't be updated easily.,1,0,,2024-02-21 05:06:23,"We apologize for your bad experience, please contact us through our toll-free number 8397.",2024-02-22 04:44:36,
1c4b07f2-e2ce-4531-8d1b-04dd4c2f2351,Solomon Kassahun,https://play-lh.googleusercontent.com/a-/ALV-UjXfue5Uo3ZskGwPc5sAx-dYl164SfJAgNulW9_6xGKdkTrYBuGZ,"It was a very nice app and was exemplary to other banks, but I am experiencing difficulties in transfering transactions and thinking to leave Abyssinia? What would you advise me. ወጣ ወጣና ሆነእኮ ነገሩ።",5,6,24.02.07,2024-03-14 08:33:49,,,24.02.07
9d157253-6414-46f1-a2f3-0867fbd3f25d,Abenezer Anemaw,https://play-lh.googleusercontent.com/a-/ALV-UjWWkhyf5Z7H39w0eADM9V2Rtrc28OoYfCiba39UGC8dFlAgPuSr,"Pretty good for a banking app, it still lacks some things with in the ui and with the speed of the app but overall it's a good application. Thank you 5/5👍🏻",5,14,,2024-07-09 12:36:45,,,
83311c04-cd01-496c-b382-2caaa5132819,Gutu Bahiru,https://play-lh.googleusercontent.com/a/ACg8ocJyu1cHcArGioHv_57x1neZ2NnmkDJwVGP8yOsX0ta9KtsXJw=mo,"Shockingly bad! Even when it decides to work, it's painfully slow and frustrating. Such a shame that it has become a stain on an extraordinary bank",1,2,24.07.04,2024-09-06 09:16:55,,,24.07.04
169b6d5b-b5df-4a42-9168-ce968142da5b,bk love,https://play-lh.googleusercontent.com/a-/ALV-UjXAG0bTTnfIB7KOxKIYSewSyuAjUhBr-If4SE4QEG5-iLSgwvaYKQ,Has some nice interface but always freezes or slow to load .App developers please fix this issue.,3,11,24.09.30,2024-10-27 13:37:31,,,24.09.30
29aa3b3c-e4c7-41c7-bbb1-5d514633c307,Hailemichael Melaku,https://play-lh.googleusercontent.com/a-/ALV-UjVLtQqWDuL3TupYfjdpfhBm_tKhtXMO3bogo6dpU-czHrNXiPk,"Worst app. It is wise to invest money and you can make it like CBE app. Even the incon has no image. My app has better UI than yours. So, please invest more and hire professional developer companies and improve it.",1,0,,2024-07-18 01:45:25,,,
aabe78f9-ca3d-4512-a1bc-68ff67518b8d,Fasika Biresaw,https://play-lh.googleusercontent.com/a-/ALV-UjXdWwLuW2fRfmcfMH0zBFdyy4WyTsw-j9wD7jbJbKDQ5ZUGMsI,App needs a lot of work. It continuously crashes and shuts down.,1,7,24.04.26,2024-04-30 10:31:00,,,24.04.26
0ce9923a-bcad-4b3a-a73d-2af80ed12dcb,Biruk Addisu,https://play-lh.googleusercontent.com/a/ACg8ocKeFJzI0RGJkXwy0PAbZd_NO27Ev2n0Tz5ObF2yzkD0lLMzzw=mo,Wow! what a disgrace for BOA. The app barely works. Too slow and always returns error.,1,5,24.05.07,2024-06-03 13:56:20,,,24.05.07
87154fba-12e2-4d6c-a471-dca084f7febf,Abraham Tezera,https://play-lh.googleusercontent.com/a-/ALV-UjWrjPf8WlqRU5Oktd8evlvsIdqxhoV2fyzwutG-eA_tzkoDWQg,It is really great to see you have solved some of the problems with the previous version. Thank you for taking time to improve.,5,86,24.01.09,2024-01-24 04:03:22,,,24.01.09
3d87e290-18b1-465e-8d58-9415ed0c6d14,Tofick Siraj,https://play-lh.googleusercontent.com/a-/ALV-UjV4cIJjrCOuMdLPewCD7kOOXabzifhAOCFO9ZfTgO8tD4iOFMn4,"Like I said before, the previous version was horrendous! I'm glad that you took time and decided to develop this awesome app. Well done!",5,42,24.01.09,2024-01-18 00:19:20,,,24.01.09
0d298d90-e15e-46e4-96af-20741b8d45ed,Amanuel Shumi,https://play-lh.googleusercontent.com/a-/ALV-UjU5bHKn8y6w7TQLIdjDsjNYQxviya3Q2s3Nhe8W2lqfoA4XMxpQ,"useless app. bank to bank transactions do not work at all, wallet topups like telebirr take hours to reach. what a shame from a bank this big.",1,0,,2024-04-25 21:37:43,,,
d38d6dc0-e707-45a4-a932-0b9bf5df67aa,Melesay Abdullahi,https://play-lh.googleusercontent.com/a-/ALV-UjVxeHxKIa0wG22ltMu8r__LYHYs2WZg89UEGPA7pC_x2Szu8o9E,Definitly better than the privious version but this one crashes frequently and needed to put to sleep on andrioid version 9,2,4,24.02.07,2024-02-20 12:32:16,"Dear customer, we are sorry to hear you've been experiencing some crash issues. Please contact us at 8397 and share as much information as you can. We will investigate your case. Thank you!",2024-02-22 04:47:15,24.02.07
4cba832b-be6a-42d3-94ff-8446fbcdf1b4,ibrahim selman,https://play-lh.googleusercontent.com/a-/ALV-UjUaS-2c_z6Gd9vvPrKMESJJqR2h96ubNMGiyJIh8oIWyABu-M73,"why do we need to turn off ""developer options"" in order to use your app, on the new update??? Are we suppose to not use our device for other purposes just so we can use your app? It is not security it is BS. (fix that and I will update my rating)",1,5,24.04.26,2024-05-01 05:46:56,,,24.04.26
a1d8f400-cdcd-4bae-8ea3-c18d55ac5967,Mulugeta Legesse,https://play-lh.googleusercontent.com/a-/ALV-UjXZGtlZuSmQ-iB5vOdLhMYTWOcCwGTp18QiKOGvuzLetc1iefI,No feature works correctly. Its always buffering and needs probably high data. So its useless 😏😏😏,2,0,,2024-04-30 12:39:25,,,
b3b60a0b-92ff-4c64-98f7-83f6e2a6ec70,tilahun yihunie,https://play-lh.googleusercontent.com/a/ACg8ocLljkFEa9XGYQjmk61rfDxL5SnowA3DnVkRtsXYFTREJMVa2g=mo,When writing amounts z app cannot insert deceimasl so that one cannot transact amounts involving cents !!! A finnacial app to be released without this feature being checked !!!,3,4,24.02.07,2024-03-20 06:49:19,,,24.02.07
94ba00d0-c2e8-4e21-9e71-af2395f2d0ca,Eyuel Hailu,https://play-lh.googleusercontent.com/a-/ALV-UjUjeTHcoVGNqKcIr4Sc8xUH870Meg3S7fEEn64A1nwU26kBxx2x,"Stop telling me what to do with my phone, BOA. Why does your newly updated app keep asking me to disable the developer options? I’m not slowing down my phone just to use your God damn app. 🤮🤮🤮🤮",1,14,24.09.30,2024-10-03 19:55:49,,,24.09.30
5816b056-8f44-4faf-92a4-a28efd01448b,Khalid Ahmed,https://play-lh.googleusercontent.com/a-/ALV-UjWWdGm616yDZa7q0Dj1rwv0GU2pqy3waLj9j-2edr39Pgyez18,The latest update has stopped android 9 phones not to open this App. Never work properly since i started using it.,1,8,24.11.22,2024-11-26 04:05:22,,,24.11.22
15744558-21d7-45fc-9350-705a7961b96e,Natnael,https://play-lh.googleusercontent.com/a-/ALV-UjXOvsHBHnWp0Po7qzOf4ue0RzVyymF7Y30rF4S1ikmgeneW-WA,"Why Why Why???? it is difficult to make transactions, it takes alot of time to make payments, i thought the update will make it work, but it got worse. please fix it",1,4,24.04.22,2024-04-28 03:51:47,,,24.04.22
e1cf5832-e81e-4e28-80f5-cbb7173dc54b,Tofik Uso,https://play-lh.googleusercontent.com/a-/ALV-UjU0FHlO1xVQclpWuC4HCJVwilVGvXfeDxFThdpzJ0kGLRFAHmA,After the recent update the application keeps crashing when I tried to open. Please fix.,1,0,,2024-03-01 12:13:09,,,
852e921a-9de5-4396-8537-910cf5896d70,Ermi,https://play-lh.googleusercontent.com/a-/ALV-UjW7Shybg5VVXiG13dN8y1VjE2xPLj7skFjppKw_zZPPByGpZ0x0,"I'm sorry but what kind of stupid developer thinks the app will be faster if we disable ""Developer mode""? I've never seen such degeneracy in my entire life, please get rid of this feature",1,3,24.05.07,2024-05-29 14:34:12,,,24.05.07
06f1e24f-10fc-461b-862c-180fb9acf4f4,Seifu Mekonnen,https://play-lh.googleusercontent.com/a-/ALV-UjVJZErJZJpkio2J_KmBmJH55n4GcohgXUoggoI-8qtwdJWHPSYG,"This app didn't work. They have a new version (new app) but still not compatible with my Samsung S8+ , which is v.funny.",1,0,,2024-07-25 02:35:54,,,
fecff9eb-a424-47c7-9fc8-e4c0898f2be8,Epheson Timotewos,https://play-lh.googleusercontent.com/a/ACg8ocKtTY_-YGBWSVICeaHFOZSnS01xFSVsXHieq_CPO4PuNeCs5A=mo,"The worst mob app i have ever seen. Slow, uncomfortable and stupid. It is better to learn from the best app (tele birr). The released updates is even worst.",1,39,24.05.07,2024-06-10 22:19:35,,,24.05.07
8f57afa4-5ed4-4db7-ab84-7b52045fa94e,Alazar Solomon,https://play-lh.googleusercontent.com/a/ACg8ocIjk4OlrTo3aHptLtiGVwMdZM4LZO-nAywwPMIJJhfgIO9yKhE=mo,"I'm Sick and tiered of enabling and disabling Developer Option Everytime I use this app. maybe you know it maybe you dont, fix it please it's anoying",1,4,24.07.04,2024-08-26 04:15:02,,,24.07.04
a597b94a-ed3c-4fa9-a749-a23d54faa49c,Biruk Ephrem,https://play-lh.googleusercontent.com/a/ACg8ocKfmRoHUnqEcYt_iWpC30utFhjw-tGtDNdUgrIDFl5AC8xzEQ=mo,"Better app than most mobile apps, but why do I have to turn off developer option every time I wanna use the app?? It's annoying.",1,5,24.07.04,2024-09-13 11:50:22,,,24.07.04
485190f3-6c28-4ba9-8be3-f589e99fd8a9,Abel Assefa,https://play-lh.googleusercontent.com/a/ACg8ocI3oJ_rvJp-Ndd0V713m43Kvo5gCIWAxQYhlJb8eB5vY00gAg=mo,I think this one is better than the prvious one much faster but try to make it more faster like nib and cbe specially nib bake their app is very nice but the bank is not anyways good job on this one,5,3,24.01.09,2024-02-03 23:19:54,,,24.01.09
cd8d39d0-d8d5-438d-9d87-904ca2c98410,habtamu gobeze,https://play-lh.googleusercontent.com/a-/ALV-UjVnjZkPcyoMLitM6gti8JgKbiC4A7FcTCecxfeRbHuWkMjhrKQp,The old version is best. This one is so lagging and it's not fast to quick transfer,1,3,24.04.26,2024-04-29 20:46:32,,,24.04.26
34325ef3-c582-4f8b-b625-dbb0a4741af4,Asier Negassi,https://play-lh.googleusercontent.com/a-/ALV-UjXEp_yZ1pXiohl_taJaGZbGJ2eHBEiJ6zrhQ7Dci2BsjBfAtWCX,"This new update really sucks.. Can't even get the chance to put my pin, bugs and everything,please fix it developer",1,4,24.04.26,2024-04-29 09:59:02,,,24.04.26
a002edef-8a3d-4867-a706-9f538a0674ed,Prince Fuad,https://play-lh.googleusercontent.com/a/ACg8ocKAk-NKZa9exXckMDsQQn5J_5tRdRfgAy1EC8zDfNFeM9-IdVA=mo,"the worst app I have ever used, I could've given 5 star if it worked properly even just for logging in and check my accounts. seemed that's impossible",1,0,,2024-04-28 02:27:18,,,
07b686cc-bf94-4164-a731-684fa29cfb83,Wurbie MJ Trading PLC,https://play-lh.googleusercontent.com/a/ACg8ocKeDcg4fLB5d70xHx3K-OQhVysHOTy1S95hM7EZBSMyfhFN4w=mo,"This is not an appropriate app, i don't know how boa develops this app, i don't expect this much crazy and un confortable app form BOA, I'm soory!!!",1,0,24.07.04,2024-09-07 00:42:49,,,24.07.04
d9c98c7f-3df6-466f-a6fc-820cb281fad1,Henok Abebe,https://play-lh.googleusercontent.com/a/ACg8ocIeRagx7ZDjhGg-K5FK9enmmKg2h2xxiNvl6Qysf2l-rHt9mw=mo,"Your app doesn't match your bank, the app is disaster, super slow. Please learn something from tele birr app.",1,5,24.09.30,2024-11-19 03:12:49,,,24.09.30
30d3f026-6e12-4489-b166-79a8bf9ed9b7,Samuel Tsegaw,https://play-lh.googleusercontent.com/a/ACg8ocLXfDbW2M5ZBhOk8cmq2Fx36bAjpgnikaO_C-iyKEKmc4Dr9zQ=mo,"I tried it with different phones, it only worked for about a week and then it stopped working. It needs some serious work.",1,10,24.04.22,2024-04-25 06:02:58,,,24.04.22
fb543429-2845-474a-aab2-95e54028c607,Ermias Desalegn,https://play-lh.googleusercontent.com/a/ACg8ocLUFLbGfj4zg7pMuoLnfEDb-lK0873F6dzAPgXBkrEiCo-Npw=mo,"The app keeps crashign again and again, i didn't even get to sign in. Worst update!!",1,2,24.04.26,2024-05-03 00:59:07,,,24.04.26
5bd5ece1-9221-4e85-9f8e-5595fa3a0755,aron habtemariam,https://play-lh.googleusercontent.com/a-/ALV-UjVJQxz94T6HHEciaIIG3MreRkpgirkC59ObtdQ7sbLdAOw9U1l_ZA,"As usual the app is ok, but this time i can't update it normally. It lags at 99% all the time. Hope it's fixable.",4,16,24.01.09,2024-02-09 23:59:36,,,24.01.09
efe89d62-85f0-453d-bc34-e71402cb2f09,yonas sharew,https://play-lh.googleusercontent.com/a/ACg8ocIvgzy3Bfxr5IH4OL7VAfki3o79yRNApA_9sT5x7oEO_Fmcqg=mo,"Riddled with crashes, cant use it anymore. Very frustrating!",1,3,24.05.07,2024-06-20 04:18:55,,,24.05.07
ec8fcf0d-19d7-446f-bd1e-907f91a67b49,mulualem chekol,https://play-lh.googleusercontent.com/a-/ALV-UjVgcZrHDKzy17oxgt_-o6x9HyZzXWxnym7ThDSNB2FI_0_915o,"It's very difficult to use the user, app,ones dawenload the user can't operate well , no one can help me,",1,0,,2024-07-23 08:36:47,,,
63a101fb-cc46-41f6-a9cc-c494cb516a50,Yordanos Getu,https://play-lh.googleusercontent.com/a/ACg8ocIjCdK48arEpUjBResgtM--dn8xc5Pu4ZGurMJnchworN0GpQ=mo,"Doesn't work properly, keeps closing won't activate any account, I wouldn't recommend downloading",1,0,,2024-05-05 09:15:19,,,
6c01b8b7-76b7-4f56-a822-bdf7674d30a0,Yitbarek Misganaw,https://play-lh.googleusercontent.com/a-/ALV-UjUo75XGG-996WcNZla8w40Cl09MuRiUI0qL7c2EL6Ym_boTijo,በጣም የሚያስጠላ አፕ በጣም የወረደ ዜሮ ነው የምሰጠው ዘሮ It's not App it's very slow ehhhh. Why don't you upgrade the app???? It's always zero,1,5,24.11.22,2025-01-18 02:33:28,,,24.11.22
fb9a7444-76cf-4f2d-a8be-72d3009a034c,Abbuu Ko,https://play-lh.googleusercontent.com/a/ACg8ocLQde0N8jF_EzgjbVD5aqfYxag-GIMRsFbVupIRUMyRtS_Uxg=mo,I was using this app for long time it amazing user friendly UI but the i can't found for get pin button in the app,3,0,,2025-01-07 01:26:17,,,
1c339143-79e1-4f37-9ea7-398b7844903b,Abdisa BirUK,https://play-lh.googleusercontent.com/a/ACg8ocJlKQewCj_KU8zEwVGBH50bzkvhMKi0WgIwwOhM0xEOKVVpOUk=mo,It keeps asking me to turn off developer mode even when dev mode is off. Couldn't use it.,1,6,24.11.22,2025-01-13 04:45:23,,,24.11.22
d77a87f6-2a20-4b6b-b7fa-acbb3d19b636,Zola Man,https://play-lh.googleusercontent.com/a/ACg8ocI0xeC1OXUeseTpId4Ll11CjG5vxZqd_Wf7Lx5ImTavednFog=mo,Make it easy and convienient to use and perfect for all to high prefrence and choice.,3,2,24.11.22,2025-02-06 22:28:37,,,24.11.22
b9b684de-8146-46ae-b1fa-8f07272c6fd2,Natnael Zelalem,https://play-lh.googleusercontent.com/a-/ALV-UjV2T6n-sh22KOhHJdvChVExeCnO5KQERSKLb0qBg0AqEA5-IMM,"Easy and sooo simple to use it, also its easy to stole someones money using the app",3,0,24.07.04,2024-12-16 02:02:26,,,24.07.04
1648df61-5880-4d2a-9ec1-c393c9ac474d,Monte Qamer,https://play-lh.googleusercontent.com/a/ACg8ocJ-ObRbopSy65IzsnO5eHZvy0tEsuvQ2MDOB62oki0Ua4OqGw=mo,"worst app and Bank ever u be ashamed, scammer",1,0,25.03.07,2025-03-24 07:00:42,,,25.03.07
10cdcbf6-81ab-4281-8583-665788be8e91,Haftom Kelemewerk,https://play-lh.googleusercontent.com/a/ACg8ocIUGMReJoSqPr9kqljDbjSNuJMOjDDH_y7GuTOwPeRf5mbV4g=mo,This app is not available on all android versions and some times it is not functional.,1,2,24.09.30,2024-11-08 03:41:15,,,24.09.30
06b0b75a-3c54-4f86-822f-a84022fe260d,nibret atnafu,https://play-lh.googleusercontent.com/a-/ALV-UjXNRHQI9_kkPSna0Or-0oE1pfv50GGiDxsS_Malak7gOMS-Yrqu,"""The choice for all"" It is interesting app,The old one was time spent to open the app. I am with you BoA.",5,4,24.01.09,2024-02-03 00:30:56,,,24.01.09
bd5bf3e9-1b1c-4019-b088-d4a965b8a6b3,Amanuel,https://play-lh.googleusercontent.com/a/ACg8ocIgj9eICY-s_kTuyG_5L8h3-R9XaAiOrXzIoTImWoEcCBG3evI=mo,After recent update the app keeps asking to disable developers options and won't let you use it unless you do.,2,7,24.05.07,2024-05-09 19:52:52,,,24.05.07
1920d8a2-4e03-4818-8a69-7c17c565ae75,Lulawit Abreham Tsegaye,https://play-lh.googleusercontent.com/a-/ALV-UjWK1DwFR8kkLvGkwOPa7OLbvP91L74DYSETzdRrh9SVv7K4r4cY,When I try to use the application it says 'developer setting should be off' where is the setting to off this play Still doesn't work for me,3,1,24.04.26,2024-07-24 00:27:07,,,24.04.26
d466304b-a933-47cd-b217-92a6a7deff41,Alazar Tsegaye,https://play-lh.googleusercontent.com/a-/ALV-UjUShOl3MFZr091LoDek1bI4lrPbeMWET4k-j6aMDhtf5WgnqZk,I used to access my Apollo account through the app before the update but now i can't access my Apollo account through this app and for me this is a step taken backwards!!!!!,3,2,24.02.07,2024-02-22 02:08:21,,,24.02.07
60c1c945-fc5c-4773-90ef-9be586aba2ce,kirubel G,https://play-lh.googleusercontent.com/a-/ALV-UjUvZ8c8r3QLhL59DaanFTc08MLRSu12AiBzj5xLxwEz0qo_32Z1,the new updated app exception handling for connection fluctuations is so exhausting which lead users to login repeated times.,1,0,,2024-04-20 01:46:28,,,
3283f02f-0474-44ec-b7d6-5e90c94d88d4,et spam,https://play-lh.googleusercontent.com/a/ACg8ocKUQl-nkNcwHxMS3j2hJYfbGjGbVxbI65epvIp-RMAvqZ7K0w=mo,Awesome application. But lately its crashing everytime i opened it.,4,0,24.07.04,2024-09-05 13:48:22,,,24.07.04
2a2d15cb-06ba-425c-a417-2f020e552505,negus _,https://play-lh.googleusercontent.com/a-/ALV-UjXLPJdXaz9jbH-x0d_TxdwjTuGLTcSe_YKP-jrR4MqKPnK09WlDCA,Crashes very frequently is not stable overall need improvement such a huge bank needs a better app than the current one,1,1,24.05.07,2024-07-18 23:35:32,,,24.05.07
eb3a8a93-a465-4992-899f-dbb1bc63fc58,Yabsira Fikadu,https://play-lh.googleusercontent.com/a/ACg8ocLfxxpZIQ-JUxYP4mQOJ2K9qCPTcD5vV45G_GgQp8PZCJ_yiNk=mo,So unreliable i had to send money asap but this app either laggs or doesn't work such a lazy work look at how efficient tele birr is and its not even a bank,1,0,,2024-05-02 11:13:04,,,
3980b4ed-4190-4d89-b8ba-e8bdc3789d31,Bereket Tadesse,https://play-lh.googleusercontent.com/a-/ALV-UjXc8HJvemM1B8ytB3FeRw8GC_lqWtlpxPleLM1P1HQojfz0M9c,Preventing login because I have developer options on is not security. Moved all my money somewhere else because I just didn't wanna deal with it,1,7,24.05.07,2024-05-11 00:30:55,,,24.05.07
758affdf-42d5-466d-a18e-4c4bbeb738fd,Yidnekachew Kedir,https://play-lh.googleusercontent.com/a-/ALV-UjXkTJe-om8DGHMuG5aIcdSPkFAQcbAyehIQQOvred0TNwNrjPJG9Q,"This app has become the most troubling every day. It doesn't work. I love the bank, and I hate the app",1,2,24.07.04,2024-07-30 23:01:07,,,24.07.04
1901236c-37ec-495a-a51a-bc8f471424ce,Teshome Regassa,https://play-lh.googleusercontent.com/a-/ALV-UjWDjCSWyiiOELLtrVwXsmIItvDP0Vj6sX6AM_Lepv0FdIhBI4ff,The poorest mobile banking I have seen in the industry. Is not stable to login and post transactions. Is not attractive. Error reports frequently.,5,256,24.05.07,2024-06-13 02:42:15,,,24.05.07
93f8ce6e-057d-408e-9856-17dd32defbf9,Michael Mesfin,https://play-lh.googleusercontent.com/a-/ALV-UjU9QImCJE7ZpOJ2wo9QG5rUsQI0KkDVwc0CdZmvy3dVyVk_vYk,"This has to be your worst app ever, damm so many bugs and it lags so baddd. Please fix it",1,2,24.02.07,2024-04-12 02:01:41,,,24.02.07
63308cb6-0ae2-4740-afd6-6ef45c6ec630,Dawit Getenet,https://play-lh.googleusercontent.com/a/ACg8ocIvdcv_iRr44ps7_EKHhILvp9hyxDvWWTDef6S0d4gJ_3WX2Q=mo,It keep making me out and crash when i open the app and not working properly,1,2,24.04.26,2024-05-01 23:11:41,,,24.04.26
8e591a54-f305-4788-a38b-56b2293a2b77,Zeinu Seid,https://play-lh.googleusercontent.com/a-/ALV-UjV3umEjG85ouBCQKk88hIBrGBOujbolzA_xj2bLARAl_dkpRN-i,The worst mobile banking app like the previous one. How long it would take for BOA to develop a good app?????? Years or decades?,1,1,24.02.07,2024-03-04 04:58:27,,,24.02.07
4c435948-feb8-4692-9f0d-3f864a03abbb,Emman_A7,https://play-lh.googleusercontent.com/a/ACg8ocL-qtIS_QPLDgwb9uBfmdyli2H23IfeJ6AIZzxVNX9dFqXDIVQ=mo,Overrated service and recently glitching service system not being able to withdraw funds.,1,1,24.02.07,2024-02-26 02:58:32,,,24.02.07
