reviewId,userName,userImage,content,score,thumbsUpCount,reviewCreatedVersion,at,replyContent,repliedAt,appVersion
db0f8d24-804c-4cf2-8a36-f1f68b6bd616,Hailye Mesafint,https://play-lh.googleusercontent.com/a-/ALV-UjX3tC16tMF4qvSmkQMwTMFfh2UXmARbbeML8umbPhCWyG-7-Tr6,"This is the most stupid app I've seen, why would I turn off developer mode just because you can't make your app secure, this clearly indicates the app has very poor implementation and unskilled developers.. There are a lot of people who need developer option for different reasons. Please for the sake of the bank, fix this thing... Even the most secure international banking apps don't require it. Not to mention the lag and crashes",1,11,,2024-07-11 18:11:29,,,
53214d92-a487-43cb-b69d-b65294b40823,Hanna Merid,https://play-lh.googleusercontent.com/a-/ALV-UjWRMfuvCl5FcZkkRaTNhy8REAe9M2gEDy57MA1SONHyDLrZBMk,"The app is essentially unusable, it asks to disable developer mode even when it is already disabled and crashes, sometimes it only works with wifi and sometimes only with data, or it crashes just because.......",1,19,24.05.07,2024-07-04 00:59:38,,,24.05.07
9151c064-a00f-4efc-ad7a-1f632401b194,Tefera Lingerew,https://play-lh.googleusercontent.com/a-/ALV-UjVXgF67-NT2ds0vvmv-24IfyPyUhBADJPQXQhHOnFBICNhA4go,"This app takes too long time to be opened. And even it is not working simply as other banks application. Why this app does not give a digital invoice. Even, I am not able to find where the screeshot is kept after transaction. So, please the developer should fix all these.",1,43,24.07.04,2024-08-07 06:34:52,,,24.07.04
d587332b-4722-427d-aa23-47df325f4f55,Asfaw Aregawi,https://play-lh.googleusercontent.com/a-/ALV-UjX6ekeJyMVl0Ayl8PJ-L6c2qtcPYIcl4A2RXE7TTHUiYeJupoQ,"I've never seen a very worst mobile banking system like this, i lost 37000 birr because of your delay transaction system, i called 8397 and they told me stay for confirmation but, after i changed my mind and waiting for confirmation call to cancel the process they sent it with out my approval, so please don't use the mobile banking system please",1,53,24.04.22,2024-04-23 08:15:45,,,24.04.22
a8423c57-d734-4ebf-9dda-4f4dd43091ec,Yohannes Addisu,https://play-lh.googleusercontent.com/a/ACg8ocKV9jjFmwOAtyseWqIKzGDKf5Ch1tNUVs1M4Oc5-HAaefld_Q=mo,"BOA is unreasonably holding and delaying transactions for more than a day, even transactions within the same bank itself. This is a huge gap that I observed in BOA mobile banking. I didn't experience this kind of challenge while having transactions in other banks' mobile banking platforms. After waiting so long, I called your customer support team and the response they gave me was ""it was the system that holds the transaction & will be released on working days"". This is not totally fair.",1,21,24.07.04,2024-09-14 22:59:12,,,24.07.04
e9072e9a-76dc-49d1-b423-cb64c4656802,Yohannes Assefa,https://play-lh.googleusercontent.com/a-/ALV-UjVwg9_NSPfIIi3K1l82YSlh3LDv-GSIaUQrd94qff5J0xwY0sQ,this version is not working for me I cannot even buy card. I cannot send money,1,2,25.03.07,2025-03-30 05:27:26,,,25.03.07
b3a22053-e2b9-47e6-8083-a2e73a7c6bed,yonas gebre,https://play-lh.googleusercontent.com/a-/ALV-UjXE7RfDi8eySDco2807b_hHR0-GAtMA29WYI7qd0R_kjITHUfxy,after i typed in my password it says successfully logged out ...and goes back to the first page,2,2,25.03.07,2025-04-04 02:38:08,,,25.03.07
b10d3c9a-d5c8-422c-9bca-82a40310fb5c,Teddy and Fli,https://play-lh.googleusercontent.com/a-/ALV-UjWmwyTMeD9quS8mnVL-8WsUjWicNmU-FPOtffGrcwObiYaPRalW,it's not work correctly... you must have update it,1,2,25.03.07,2025-04-06 01:01:42,,,25.03.07
53263f41-9dd6-4165-a24a-a41fda4c390c,Nati Kasahun,https://play-lh.googleusercontent.com/a-/ALV-UjX_oJS20sQqMojAKhqZSlSXTSSs7UpU4a8wSc8B1SFWw_Dg1lX5,good but they don't update enough don't add new things,3,1,25.03.07,2025-04-04 02:24:06,,,25.03.07
7fd70a5c-3336-4c74-b321-622b29e5d371,Temesgen Ayneka Shonge,https://play-lh.googleusercontent.com/a-/ALV-UjVbfI_8NA2drkTR1-ip8raB7cJ15ObMZiK8GTFUcjVRLFRvtKe7,"Installed the latest version of this app on my Android 14 device, but it is not working. I have already received the activation key from your branch (via SMS), but couldn't activate it. It is a failed app. I bet you don't have QA testers.",1,34,24.04.22,2024-04-24 11:05:57,,,24.04.22
0e5e093a-1cf1-4c49-87ed-046888b8afa9,Nati Man,https://play-lh.googleusercontent.com/a/ACg8ocJoSKu3qrT2tWJn0-ef8I4N1pncAiOOBW_I6SKxvZpBhVyZMw=mo,"Decent, but there problems sometimes it says error When i transfer money but infact it transferred because of this bug i transferred 2 times instead of 1 and also we can't transfer money to others telebirr acc we only can to our self BOE Dev fix this !!!",3,3,,2025-03-10 23:22:01,,,
1962d1c4-e2c2-4ac7-91b6-b0a75ae11d7a,Abel Tesfaye,https://play-lh.googleusercontent.com/a-/ALV-UjVIYC92EdgEqTJoHj55sKZYnWbOabm7fjrhMmSx0h4qJxxHC4u_,Worst mobile banking app I ever experienced I was blaming other apps but comparing with this they're too much better!!!! It clashes it takes much longer time to login while loading in short it's a complete of trash,1,5,24.11.22,2025-03-06 11:44:28,,,24.11.22
6b5a5455-dcd0-4a2a-8cbb-f0deb5706498,Rakeb Mulugeta,https://play-lh.googleusercontent.com/a-/ALV-UjX1VVX2AC5KbOYILSBO_pFAdZNJCxr-eZ04qJ0OD5Y00RIVDaLO,i have went to the bank so many times because i couldn't make any transaction i can only see my balance nothing else so what is the point of having mobile banking if i can't make any transaction with it please work in that,1,2,,2025-03-21 00:49:11,,,
0392e082-49c5-4493-a4ca-14430e890d1b,Adam Tube,https://play-lh.googleusercontent.com/a-/ALV-UjURmMFTtpuh907-x_27XsbN_ZGHF1_32dmqZu3usyf5FcLcvlKq,"Worst App it ain't allowing yo activate not even in the nearest branch are able to activate it. I have been client of the bank for 10years. What is this BoA? As we know it being a leading in simplifying banking service this App needs to be fixed. Then we will give it better rate,",1,16,24.02.07,2024-02-12 23:33:13,,,24.02.07
821887b9-da34-47e7-9eab-d9559813d40e,Mikias Berhe,https://play-lh.googleusercontent.com/a/ACg8ocLaSKSinYWGHuul6oAWu5CdWYbHxRGi-48mxYGLSmJD1mze-w=mo,"Great graphics, but why my music have to stop when I open this app? Make it make sense. But overall, it's good, but also needs too much data just to load this app. We might need a lite version of this.",3,1,,2024-02-15 01:22:15,,,
dc201a15-30b2-4d8b-8754-0ecc2db8130b,Mc solo,https://play-lh.googleusercontent.com/a-/ALV-UjVsd1y7nIG7dQbqhLKtO23W0xBWTQdoeGNObtTN2gavQitlzwyv,"the app used to run fine, but now it takes like forever to even open the main dashboard and sometimes it just crashes on its own. you guys gotta step it up. we need this app to be way faster",1,9,24.05.07,2024-06-27 13:33:38,,,24.05.07
94d435e8-8e1a-43e6-8a3c-bd755d66064e,Michael Bayray,https://play-lh.googleusercontent.com/a/ACg8ocIZBoAEiIvh4BsSPNWNgLrBBgRWUHzu2cKTjyA1PaJqaUssSg=mo,The app keeps crashing it stops responding while I'm using it or trying to open the app. Now I have to go to the bank in person to do any banking activities. In short it is the worst mobile banking system in Ethiopia,1,25,24.04.26,2024-07-11 05:10:32,,,24.04.26
e4f460a1-24e4-48c8-8a36-477f91417816,Yididya Fantahun,https://play-lh.googleusercontent.com/a-/ALV-UjXMoUA8DFSFRdXOC9yPWljO8KSGPXbGjin1bSqWBnNPtJcZu3Vb,I have nothing against your service but your App!!!!??? When will it ever work? Why do you keep changing the interface whenever there is an update? The most unreadable annoying app.,1,13,24.02.07,2024-03-22 04:36:57,,,24.02.07
1bdac495-0844-4896-b693-213485aad561,Dallol App,https://play-lh.googleusercontent.com/a-/ALV-UjVblQTqhxQOMp4nEMk91ykiixEM2H0Z6kkh-jDLHIikNnMB4ow,"I can't believe in this day and age, one of the major banks of the country can't seem to understand that having a working mobile payment option is a **MUST** to survive. I have decided to move my accounts to CBE and Awash because of this. Can't be bothered with this useless app.",1,16,24.05.07,2024-07-04 04:46:13,,,24.05.07
a434370c-550c-4ae9-adcb-7a02aea1c130,Mukemil Rahmeto,https://play-lh.googleusercontent.com/a/ACg8ocKUEdc3iaebqyizwt_Le327XKZ4uZ72hh_kLnFQ77TmkBznUg=mo,I'm disappointed with the recent changes to this app. Disabling developer options for functionality seems unnecessary. The previous version offered a more user-friendly experience.,1,34,24.05.07,2024-06-06 02:20:54,,,24.05.07
d8c26573-6298-42ad-b768-d2981e2ec79b,Eyasu Ketema,https://play-lh.googleusercontent.com/a-/ALV-UjVrk18OTDh1H5Y1wU_PhLkakSUzDdHPG5rtVJoRFSMdznmCjO_YOg,It's just terrible. It kept crashing in middle of transaction. Hell sometimes it won't open. My phone is stock Android (pixel 8) and I don't even know how this happens. Fix it!,1,23,24.05.07,2024-05-20 09:24:24,,,24.05.07
27614b2a-f8e3-48d6-8cb2-9a83c03e36a3,Henok Loulseged,https://play-lh.googleusercontent.com/a-/ALV-UjXId4LRO6iQWmMxpAONQJV4z9AyNYTG_vuUaNAmUBgRqDS4vzc,"Its nice platform when i compare with the previous version! But, when i try to use mobile banking the app states use the updated one! As it orders, i updated BOA from playstore, when i try to use mobile banking on the following day the same thing-update from the playstore!!!!",5,329,24.02.07,2024-02-20 06:54:44,"Dear customer, We are sorry for the inconvenience please contact us at 8397 and share as much information as you can. We will investigate your case. Thank you!",2024-02-22 04:49:40,24.02.07
1756e606-985f-44eb-bab4-95bcf0848416,Hildana Endale,https://play-lh.googleusercontent.com/a/ACg8ocJcY_kPjcrFQoUdTEzhwDAMZkdbKHKRt-wb1ucbOM7DZqBrmA=mo,This application is losing major factions on a daily basis. I can count how many times I have used this app; it is completely useless and disappointing if I am not going to use it in times of need then I don't see the point.,1,19,24.11.22,2024-11-27 23:17:48,,,24.11.22
f2fac0e0-abfb-4625-8443-a49953389605,betreab argaw,https://play-lh.googleusercontent.com/a/ACg8ocKvKFzt0xdg9H8Nv3wIv3K0cMOTBCCVxUDz_aBhlqq_4z2_Og=mo,"Unreliable, expensive service. Most of the time, it is not working. Sometimes, it will take more than a day to complete transactions and charges more for this unworthy service. I will not recommend this bank app to anyone.",1,9,24.05.07,2024-06-10 13:09:57,,,24.05.07
2d52d1a5-525c-4655-b858-e8d0d2e20bc2,Abemelek Fasika,https://play-lh.googleusercontent.com/a-/ALV-UjU3LHZFA66WHyZ8JIqw9DpxQsoVJS_Ew0gn8myEouUAEBrV3FTr,Why is not letting me access my account. The whole point of this app is for me to gey access to my account without physically being at the bank. I would give it a zero but a one will suffice to get my point accross.,1,8,24.11.22,2024-12-27 02:28:26,,,24.11.22
25b7eec9-d1ef-41be-8bb3-3fd1b1cb8068,miki,https://play-lh.googleusercontent.com/a/ACg8ocILvBTtCBgtXCBfDg6l4_1_4BmDhiBmyJUK4YisbPleDz5T7g=mo,"please add language in the apps setting(amharic afan oromo, tigniya,and others) sometimes bank to bank transfer is not available through time and even if if it is available not reachable…it is serious issue!",1,3,24.11.22,2025-02-15 07:15:50,,,24.11.22
49b877c9-5536-4be5-8674-e3ae975fa0ed,Cyber boy,https://play-lh.googleusercontent.com/a/ACg8ocICFlKeHKgnvkHobS5K0iNiXYmssT2ABsjVhtrH69xcfpTi9g=mo,"I downloaded the app for the first time while reading other customers reviews and as soon as i installed and opened the app it closes back automatically, what unserious bank, now i uninstalled the app immediately",1,1,,2025-03-02 22:24:29,,,
481a1e89-df8b-43d4-9bf7-aa4a5cd196f5,Nebil Ahmed,https://play-lh.googleusercontent.com/a-/ALV-UjWPze-fCUFDlfwnzVuJLTgkflRsFOaEM-SUC_IviXDzxxkFtoBu,The App is not working on Android 9.1 at all. It shows an error notification and forcefully closes the app. Must be fixed ASAP.,1,23,24.07.04,2024-07-19 08:36:11,,,24.07.04
d1f72257-e5c2-4da7-ab88-1bf64322de8a,Mahider Mulugeta,https://play-lh.googleusercontent.com/a/ACg8ocLUAUiuH5QZW-MG3mznlzFYLqNj2qPC53WHQRUZeuHDlxot4Q=mo,I am having a challenge to use the app. The app does not allow to update the previous app. Neither does it allow to manually insert OTP - BoA please modify the app to allow these features,3,3,,2024-02-06 08:31:28,,,
c9f8ff21-b8d1-400f-bb94-c98399a25ad5,Bamlak Sintayehu,https://play-lh.googleusercontent.com/a-/ALV-UjXB-UU_XEeGfWyHcMVo0jwChi13gQnx_cZFC_nJCgsn80kG8d8,"The bug is still there,the app crashes every time i try to log in, especially in old phones like my Galaxy A32",1,1,,2025-03-10 10:11:15,,,
d1db8100-c3db-4123-a13d-b2c111104f34,Abel Agegnehu,https://play-lh.googleusercontent.com/a-/ALV-UjW74gkxiz5iIhZZMwpjDsPVq7WLB9Nf7UlFbygMUfq8X9F1-3wI,"This app is way better than both Apollo and the old mobile banking app. It's super easy to use and loads really fast. If you already have boa mobile banking before, activating it is a piece of cake. Great job on making such an awesome app – keep it up !",5,92,24.01.09,2024-01-27 09:13:35,,,24.01.09
881841d6-eb17-46a9-9975-60090151aa37,Tesfay Teshome,https://play-lh.googleusercontent.com/a-/ALV-UjXpJoohghIZLcqpaxTfcfRRMDresgtzd2yisU67nUwP7SXeut2F,Worst app ever previous version was way better than this version after I activated my mobile banking app it says account not found but I'm their system my IB customer does work fine please fix your bugs and test it before you release it I have visit and report many branches and head quarter but they can't fix the problem,1,6,24.02.07,2024-03-23 01:39:09,,,24.02.07
ffe4b898-4efa-4a93-bf70-dd405f3edde4,H F,https://play-lh.googleusercontent.com/a/ACg8ocJSc7xJD23FKUj5wMGPQ-nILrQA01HWEYoYVi0-ijIvOwroleM=mo,I don't know why they roll out new updates without making sure it works! Why???? Do they need to update to a new staff? Perhaps pay for a better network?? Mindenew? I don't know there always a problem with this app.,1,6,24.02.07,2024-03-01 17:59:27,,,24.02.07
13cb3aad-a536-447c-8e30-2d7eaedcf5e4,Amanuel Abiy,https://play-lh.googleusercontent.com/a/ACg8ocLf9RmNCoR23wUTrIe9j9RswWcnaK0nnG6_8rfO1JBVJBFawOq_=mo,"The application used to work well. But after updates I'm not able to use the forgot password feature, which is blocking me from accessing it as a whole.",1,9,24.07.04,2024-08-20 02:35:21,,,24.07.04
0eee74b6-043c-4004-9db6-1f923ecfa564,Nafle Skip jr,https://play-lh.googleusercontent.com/a/ACg8ocJVbUBWsV-_QmAR3udKUehj69oedPe7-YFcLRcTJIuP2dtfCwk=mo,"It has good backgroud and simple. But keeps saying no conectivty , login, Close immediately you made it porly not woriking on stable network!!!",1,8,24.02.07,2024-04-21 11:00:31,,,24.02.07
b12b3e39-f4c6-48bf-86bd-e50202d37452,Samra Solomon,https://play-lh.googleusercontent.com/a-/ALV-UjXWukd4tkybHmUN8cheZzxzlMnPNKtwjgV1AZjfOMaDfMYPItm_,"By far the nicest looking app by an Ethiopian Bank. But it's functionality is weak. It is full of Transaction error, Function Error. Kudos, but it needs more backend work.",2,10,24.04.22,2024-04-22 06:44:12,,,24.04.22
4266eaeb-37b0-4cc4-8b8a-2929e01e4f2f,Ephrata Yimam,https://play-lh.googleusercontent.com/a/ACg8ocKaR3kCgV8w7f5gnxrc9OKURw0EaS960X1DK3FooxFjat85Mw=mo,A lot of the app's features have been rearranged but sometimes it works sometimes it doesnt...and that makes it less reliable specially at times of need...pls improve it,2,7,24.02.07,2024-04-18 00:16:41,,,24.02.07
5b6eabc7-30fd-4b72-ba91-8acb7763f48b,Befekadu Teka,https://play-lh.googleusercontent.com/a/ACg8ocKiTCtrp5tU4ZlgT56EDAu_NZHBw2LLmMU7l6mJ1X1k_uO_8g=mo,This app is the most worst app I used in Ethiopia and belive me I know I live in Ethiopia. Being the fincial app It doesn't work when you want it. It makes you wait for cash out code and immediately debit the amount before sending the code I have got to say abysinia bank I didn't expect this from you and I use CBE mobile banking,1,3,24.05.07,2024-05-18 03:42:05,,,24.05.07
8d23e22a-989a-44bb-81bf-3f34c868d3de,Cakoma Soira,https://play-lh.googleusercontent.com/a-/ALV-UjWK1iSrRHm_slj7w66yYeO3xWhCiqvmsIu7yFJLpKx2Fojx090,Hi I have problem with this App BOA mobile I don't know what is wrong with this App I did many times download but it's sam doesn't work if sam like that this app way I have to be customer with them how I know my account and checking save The book is no Not enough alone,1,5,24.07.04,2024-08-27 20:35:38,,,24.07.04
2ed20bd2-3a87-458d-8757-635f698d0e6d,Brook Abebe,https://play-lh.googleusercontent.com/a-/ALV-UjWL9dIy9LO-A00OcmBuwx4s3k3qYTfPtPTbknKnqmXe-MBQSamU,The app has bugs. Signing in is still a challenge. Transfer to another bank is impossible. The app is slow and bland.,3,9,24.05.07,2024-05-10 23:25:28,,,24.05.07
cdba46f4-4ab0-43ec-8d9a-e695cd895794,Girum Ab,https://play-lh.googleusercontent.com/a-/ALV-UjXsF4nj1yb14QAj5xJivW8-HlhsgWKTJ-cNXtCucd8YYbw22gcx,Sorry to say this compared to other banks mobile app its the worest it need more improvement the app doesn't match the bank standard it need more update its too slow plus it keep saying stop developing option on your phone when no developing setting enabled ??plus when it come to recent transaction nothing to display...,1,8,24.05.07,2024-05-24 10:38:48,,,24.05.07
d2509015-b677-4dbc-ae07-99e399be5ebf,Biruk Worku,https://play-lh.googleusercontent.com/a/ACg8ocJ4iAYMdvFHYAcvLVc-Vds69hrTclJpzWIfY7p8TSioqsPJrA=mo,My advice for whoever reading is go look for other bank(awash bank is a great example). This bank won't even allow you to access your money when you want. It has bad servers which don't work(respond) on time.,1,14,24.05.07,2024-05-11 09:15:12,,,24.05.07
872b3daf-6c3e-43e9-a7cf-ba1199c25010,Asmelash Abrha,https://play-lh.googleusercontent.com/a/ACg8ocKklF6GGxw3O7RQ5qUHljU2gMTlY-0isEO5y0Cwsmy4t2qOfw=mo,It was working good before the last update but after the update it asks to disable developer option. why is that? That means any developer with developer option enabled can't access his account. It crushs a lot of times.,2,17,24.04.26,2024-05-01 13:14:29,,,24.04.26
ac808508-e45d-425f-9fd9-49c6eecdb46f,Henok Wubet,https://play-lh.googleusercontent.com/a-/ALV-UjV38chnZ19RVosx485PRG8Be0pv9M5XXtq5UATB-WsBGOwgwEuS,"The app is terrible, nothing functions properly. Especially since the latest update, it crashes all the time.",1,2,,2024-04-30 22:36:53,,,
c3c57420-55b1-4d02-956b-cbdc55b33e41,Gezahegn Asrat,https://play-lh.googleusercontent.com/a-/ALV-UjUnS9ZBlHlKZHERIWbUIBbXsqkJXWr7GVb4i_9bGnWceRH3mA3C,"After last update, the app keeps crashing, not working. Pls fix it. Mobile transactions become impossible.",1,12,24.04.26,2024-05-01 23:10:03,,,24.04.26
1e10c54c-f676-477c-9a7b-bb0aba1aeb9e,Melkamu Gudeta,https://play-lh.googleusercontent.com/a-/ALV-UjW2VoJsVcGKlrCCVWGWnP-y-m6OGC8IIS_HxYF9AxQLSWFycXQ,"It say ""The request was not successful. please check device connectivity or try again"" why? One of the bank manager told me it is because of my phone's android version which is 9.1 It is ridiculous! Disappointing",1,9,24.07.04,2024-09-11 12:39:38,,,24.07.04
3a07b9bf-de50-41a0-a880-d8956c350036,S.B,https://play-lh.googleusercontent.com/a/ACg8ocJo-9GxuUbONw2Yc6TKXReIs3dttLIWebVD_1jtnHFJdGusEA=mo,"Slow login, crashes frequently, annoying app ever. Since you updated this app, it's been extremely unhelpful.",1,9,24.04.26,2024-05-01 07:40:11,,,24.04.26
98205344-768d-4132-bc7a-3c86650c6db1,Abol Networking,https://play-lh.googleusercontent.com/a-/ALV-UjVgNrHUwS5GVOAgvEeOMfkm7dnJ62IlmT-vRxCyEqiMOLzwmJM,"I don't know why every time you come up with a new update the app get worst than the oldest, it is taking more time to load, can load money to telebirr, can't pay awach. Please try to fix it.",1,12,24.04.26,2024-05-01 21:00:51,,,24.04.26
78e8871b-9992-401f-a928-98f5bfd7bb16,abdu Mamed,https://play-lh.googleusercontent.com/a/ACg8ocLaDtSVA3qBZzwlhkU7_aNsPvdvXcFl-N1aM5uWnVB-m1Kg3Xw=mo,The latest update has a bug it keeps crashing. Please fix it it's so inconvenient to do our business this way. That or we will switch to other banks,3,11,24.04.26,2024-04-29 20:01:28,,,24.04.26
98b97eb6-5299-43f7-a372-45b0a486318b,Iyou,https://play-lh.googleusercontent.com/a-/ALV-UjXDBSDCeORC1YXBp9e0S1CkFJWFWf1XdfcYu0heV-s0AWrwwgCB,"A total disaster of an app. Always offline, never works, it's embarassing. I've lost hope and taken my business to a competitor",1,10,24.07.04,2024-08-08 05:31:00,,,24.07.04
005d202c-1b73-435b-b0a4-888e815972f6,A.E.M Entertainment,https://play-lh.googleusercontent.com/a-/ALV-UjUigrae6mWM_PHw2Dm5TFGI3vvZt3JqGhA0hx7O_UcI9o9nqHJK,"""I am extremely disappointed with the poor service I have received. It is unacceptable that I cannot make transactions of 30,000 Birr and sometimes my money gets stuck in the air. As a result of your incompetence, I have been forced to change my bank account. This level of service is completely unacceptable and needs to be rectified immediately.""",1,10,24.04.26,2024-05-05 15:13:23,,,24.04.26
85a692a1-c9ed-4525-a373-8756f3b9724a,Abdi Asres,https://play-lh.googleusercontent.com/a-/ALV-UjUH2SBM2b98Kr2QgExDGG3xnjJyJ0ed2Cwp4EjmhSKE3G4MhtNT,"Worst app ever, not user friendly, even doesn't serve basic functionality correctly, takes to much time to login and navigate through the app, we expected more from this bank",1,6,24.07.04,2024-08-07 03:03:34,,,24.07.04
6e039674-a668-43a6-8d89-201a4c32000e,Haylemaryam Daget Tesfaye,https://play-lh.googleusercontent.com/a-/ALV-UjV1rzIwmItMa7-IywrCsSGOuBqSMo28gXiiVznqPQt5oZFVkump,"Despite the enhanced technology you have, the application doesn't work properly, and it asks for the developer option to be turned off, fix that.",3,22,24.07.04,2024-08-12 03:23:20,,,24.07.04
4fef53fb-1b5d-4262-b097-1436650e85b4,Abel Girma,https://play-lh.googleusercontent.com/a/ACg8ocKmEomPyTfgfr-QA5P-8O-ABXuJmeiJW-dV7XMAVZ7Zb_sh3g=mo,I prefer the earlier version. This updated app crushes during login and says there is bug. Please fix the bug issue.,4,18,24.04.26,2024-05-03 08:19:24,,,24.04.26
d02b75ee-2f90-4c29-a169-b21045b50827,Daniel Weldu,https://play-lh.googleusercontent.com/a-/ALV-UjVFfSKWyRoOqsr2qtE747I_AoH-qra_plAOVQML-2q7sblTRZ6n7Q,"Its amazing and easy to use , but from these two past days it crashes and tells me ""there is not enough connectivity"" while my internet was good enough , and i can't open it anymore !! Fix this proplem ASAP.",5,11,24.02.07,2024-03-01 13:09:40,,,24.02.07
b6e1b58d-d5d6-4134-b837-32c4833850ae,Semeab Seyoum,https://play-lh.googleusercontent.com/a-/ALV-UjWG_xyZ84zCN62EY2LfqjmJneZzMb6YBRUrQIUdleypkVKhink,It usually crashes and the reason it gives is a problem on internet connection although the internet was fine.,1,4,24.07.04,2024-07-23 00:35:15,,,24.07.04
0064eed9-e5be-4a49-a552-8ad9189579b3,Brook Wakie,https://play-lh.googleusercontent.com/a/ACg8ocLdN-DB0ZOE31IiHQLRX_Gf_G2IHwVOWROjtoev61MNpIv8Tw=mo,"It was working fine a couple of days ago, in the utilities section of payment it only provides a few services but that is OK for now but my issue is it has started crashing down these past 2 days",2,5,24.02.07,2024-04-21 05:59:22,,,24.02.07
1d426479-7c59-42d4-b349-7bc3afaf374e,Nahom,https://play-lh.googleusercontent.com/a-/ALV-UjWcl1nkQR9PpIRPEcXLoNOjNuN83G-kaMLeWzaqzu4zKgy_MrSS,The app does not open sometimes it says coonection issue which i dont have and after it opens it has bugs while using its not smooth to work with please improve it,1,6,24.07.04,2024-07-31 05:03:12,,,24.07.04
ac7391a6-712b-424c-970d-6dba1a0dd845,neo,https://play-lh.googleusercontent.com/a-/ALV-UjUWH968PvCcevINog77ROwuVSxyL0xi05_qaQZUZ2XV8pDuqWBj,Overall good app but performance needs some improvement also sometimes when using instant other bank transfers it refuses causing to be repeated several times to transfer,4,1,24.07.04,2024-10-04 13:34:24,,,24.07.04
cb36493e-3bbd-476c-82a6-88278d2ea490,Dagmawi Worku,https://play-lh.googleusercontent.com/a-/ALV-UjWyVMooOHzlpBULG4hdg_khxIbekxG9DW8Rv-7bcFqbvMmizNzb,I love boa but the mobile app isn't as good as the older version when the app gets update it gets worse and worse it doesn't even work..fix the issue with that,2,13,24.04.22,2024-04-28 04:20:40,,,24.04.22
3d362e0c-4c39-498b-8b61-b52226effacd,Daniel Berhanu,https://play-lh.googleusercontent.com/a-/ALV-UjVTC18XOazq8si9u1OQCyLWevPXAnVaklO3VKcHFuXz2YVMAIg6,"The worst app update ever. Why would you include the ""developer option off"" thing here? Why do you care? It is my phone my money, right? That is the reason why I switched to other banks. So either turn it off or everyone will discontinue their business one by one.",1,22,24.09.30,2024-11-17 11:11:45,,,24.09.30
68104af7-50d8-4340-b657-d94b6b993573,Asmamawu Abera,https://play-lh.googleusercontent.com/a-/ALV-UjWAO8JNMuJfR3Qs_eQT4QkTLYMz_y77FY58BDcqR-l849_BIkx6,"I never ever seen the worst commercial app like this in my life , it does not work anything , i donot know how the IT Team of the bank tested and launch the app. Its annoying !",1,16,24.04.26,2024-04-29 23:20:42,,,24.04.26
8e9bcb5d-012f-4969-bb6f-c5a715e31318,Gizachew Balew,https://play-lh.googleusercontent.com/a-/ALV-UjWSWib9R3BknXlu81Urf2VOiLJ49ea5dFHc0mqRuamlVIzgdet6,"One of the weakness in BOA is it's mobile App. I hope this will address some of them, but it is very critical to work on modernizing and ensuring the security of it's mobile banking system in this digitalized world",3,7,24.01.09,2024-02-03 20:03:19,,,24.01.09
d99c1e28-22e9-488e-b561-861e8282b60a,Hailsh Abyssinian,https://play-lh.googleusercontent.com/a-/ALV-UjXpUTY-KTJXAh3gNxx73I_CqByhWZx0NqAh8tAgCYAXhQHVuG7R,"Simple, fast and easy to use. I had bad experience on apollo and the older version of this app is too slow.",5,8,24.01.09,2024-02-05 00:58:49,,,24.01.09
7e629e12-154b-4482-a805-90bf721f5011,Sha net,https://play-lh.googleusercontent.com/a/ACg8ocLchLx5ZcHlFIK1Oq5W9ZjETZjvdzB_q4_--0Bbed5COfXsUQ=mo,I don't have words for your great work.. Really Good .what i like the most is the screenshots features is included which gives you the transactions detail ...Great Work...KEEP IT UP !!??,5,30,24.01.09,2024-02-03 08:07:15,,,24.01.09
